family,run_name,status,dataset_scope,evidence_path,key_metrics,failure_mode,diagnosis
frequency,v13_tf_plus_lowfreq_mamba_main,unstable_nan,MOT17 proxy0213-trainline,/gemini/code/FMtrack-main/FM-Track/outputs/bytetrack_fa_mot_mot17_v13_tf_only_val0213/train/log.txt,nan_lines=6; val_epochs=0; tracker_root_missing=1,optimization instability and broken validation bookkeeping,"Epoch 1 develops NaNs across id/match/frequency losses. Epoch 0 validation finishes but tracker root is missing, so the run never produces a usable paired validation record."
frequency,v13_tf_plus_lowfreq_mamba_fixnan_v4,stable_but_collapsed,MOT17 proxy0213,/gemini/code/FMtrack-main/FM-Track/outputs/bytetrack_fa_mot_mot17_v13_tf_only_val0213_smoke_fixnan_v4/train/log.txt,best_epoch=5; HOTA=24.79; AssA=9.55; IDF1=18.72; MOTA=11.46; IDSW=19693,identity semantics collapse after numerical stabilization,"Repeated fixnan attempts stop the NaNs, but the stabilized run collapses to extremely low association quality and massive switch count, so the family is not rescued by simple numerical fixes."
frequency,v14_tf_sfi_mot20_val05,stable_but_off_carrier,MOT20 val05,/gemini/code/FMtrack-main/FM-Track/outputs/bytetrack_fa_mot_mot20_v14_assoc_only_val05_sfi_20260305_091550/train/log.txt,epoch=0; HOTA=68.65; AssA=66.02; IDF1=80.55; IDSW=834,evidence gap on the canonical carrier,"The conservative SFI-lite branch is numerically stable on MOT20 val05, but it was never carried through a clean paired MOT17 canonical-baseline audit, so it cannot answer the current paper question."
laplace,v15_laplace_proxy0213_heuristic,effective_proxy_positive,MOT17 proxy0213,/gemini/code/FMtrack-main/FM-Track/outputs/v15_laplace_proxy0213/laplace/tracker/MOT17-train/pedestrian_summary.txt,delta_HOTA=1.947; delta_AssA=2.886; delta_IDF1=2.436; delta_MOTA=0.264; delta_IDSW=-56,not globally invalid; useful but slice-dependent,The fixed Laplace reliability branch improves proxy0213 on every main metric and reduces ID switches. This family had a valid positive regime before the current official-host work.
laplace,v16_laplace_trainable_gate,trained_but_regressed,MOT17 proxy0213,/gemini/code/FMtrack-main/FM-Track/outputs/bytetrack_fa_mot_mot17_v16_laplace_gate_proxy0213_20260307_113345/train/log.txt,best_epoch=0; best_HOTA=53.40; best_AssA=45.16; last_epoch=2; last_HOTA=51.97; last_AssA=42.81; last_IDSW=744,trainable supervision degrades the reliable heuristic branch,"The trainable Laplace gate does not explode numerically, but validation degrades after epoch 0 and never establishes a positive regime. The learned objective appears to hurt reliability calibration instead of helping it."
